{
  "id": "oe_001",
  "principalId": "prn_biz_acme-co-001",
  "scope": { "type": "tenant", "id": "tnt_acme_001" },
  "agencyExpressionId": "ax_001",
  "agencyFrameId": "af_001",
  "eventIds": ["evt_010", "evt_011"],
  "action": "draft_content",
  "contextUsed": ["principal_profile", "recent_events"],
  "assumptions": [
    "Brand voice prioritises warmth over technical precision."
  ],
  "confidence": { "value": 0.78, "producer": "model", "calibrated": false },
  "humanApprovalStatus": "pending",
  "resultSummary": "Drafted three product descriptions for single-origin coffee bags.",
  "payload": {
    "drafts": [
      { "sku": "ETH-YIRG-250", "title": "Yirgacheffe — citrus & jasmine" }
    ]
  },
  "audit": {
    "createdAt": "2026-05-09T14:00:00Z",
    "createdBy": { "actorType": "agent", "actorId": "drafting-agent" }
  }
}
